{
 "wal": "1.0",
 "meta": {
  "title": "Musync Demo (dandiya style)",
  "duration": 172.823,
  "bpm": 124,
  "meter": 4,
  "key": "D minor",
  "styles": [
   "dandiya"
  ],
  "generator": "musync-analyze/0.1 + musync-draft/0.1",
  "created": "2026-10-22T15:14:16.803Z"
 },
 "timing": {
  "beats": [
   0.488,
   0.975,
   1.44,
   1.927,
   2.415,
   2.902,
   3.39,
   3.878,
   4.342,
   4.83,
   5.317,
   5.805,
   6.293,
   6.78,
   7.245,
   7.732,
   8.22,
   8.707,
   9.195,
   9.683,
   10.147,
   10.635,
   11.122,
   11.61,
   12.098,
   12.585,
   13.073,
   13.537,
   14.025,
   14.512,
   15,
   15.488,
   15.952,
   16.44,
   16.927,
   17.415,
   17.903,
   18.39,
   18.855,
   19.342,
   19.83,
   20.317,
   20.805,
   21.293,
   21.78,
   22.245,
   22.732,
   23.22,
   23.708,
   24.195,
   24.683,
   25.147,
   25.635,
   26.122,
   26.61,
   27.098,
   27.585,
   28.05,
   28.537,
   29.025,
   29.513,
   30,
   30.488,
   30.952,
   31.44,
   31.927,
   32.415,
   32.903,
   33.39,
   33.855,
   34.342,
   34.83,
   35.318,
   35.805,
   36.293,
   36.757,
   37.245,
   37.732,
   38.22,
   38.708,
   39.195,
   39.683,
   40.147,
   40.635,
   41.123,
   41.61,
   42.098,
   42.585,
   43.05,
   43.537,
   44.025,
   44.513,
   45,
   45.488,
   45.952,
   46.44,
   46.928,
   47.415,
   47.903,
   48.39,
   48.878,
   49.342,
   49.83,
   50.318,
   50.805,
   51.293,
   51.78,
   52.268,
   52.756,
   53.243,
   53.708,
   54.195,
   54.683,
   55.171,
   55.658,
   56.146,
   56.61,
   57.098,
   57.585,
   58.073,
   58.561,
   59.048,
   59.536,
   60.024,
   60.488,
   60.976,
   61.463,
   61.928,
   62.415,
   62.903,
   63.39,
   63.855,
   64.342,
   64.83,
   65.318,
   65.805,
   66.293,
   66.757,
   67.245,
   67.733,
   68.22,
   68.708,
   69.195,
   69.683,
   70.147,
   70.635,
   71.123,
   71.61,
   72.098,
   72.586,
   73.05,
   73.538,
   74.025,
   74.513,
   75,
   75.488,
   75.952,
   76.44,
   76.928,
   77.415,
   77.903,
   78.391,
   78.855,
   79.343,
   79.83,
   80.318,
   80.805,
   81.293,
   81.757,
   82.245,
   82.733,
   83.22,
   83.708,
   84.196,
   84.683,
   85.148,
   85.635,
   86.123,
   86.61,
   87.098,
   87.586,
   88.05,
   88.538,
   89.025,
   89.513,
   90.001,
   90.488,
   90.953,
   91.44,
   91.928,
   92.415,
   92.903,
   93.391,
   93.878,
   94.343,
   94.83,
   95.318,
   95.806,
   96.293,
   96.781,
   97.245,
   97.733,
   98.22,
   98.708,
   99.196,
   99.683,
   100.148,
   100.635,
   101.123,
   101.611,
   102.098,
   102.586,
   103.05,
   103.538,
   104.025,
   104.513,
   105.001,
   105.488,
   105.976,
   106.44,
   106.928,
   107.416,
   107.903,
   108.391,
   108.855,
   109.343,
   109.83,
   110.318,
   110.806,
   111.293,
   111.781,
   112.268,
   112.733,
   113.22,
   113.708,
   114.196,
   114.683,
   115.171,
   115.659,
   116.146,
   116.611,
   117.098,
   117.586,
   118.073,
   118.561,
   119.049,
   119.536,
   120.001,
   120.488,
   120.976,
   121.464,
   121.951,
   122.439,
   122.926,
   123.391,
   123.855,
   124.343,
   124.83,
   125.318,
   125.806,
   126.293,
   126.781,
   127.245,
   127.733,
   128.221,
   128.708,
   129.196,
   129.683,
   130.148,
   130.635,
   131.123,
   131.611,
   132.098,
   132.586,
   133.05,
   133.538,
   134.026,
   134.513,
   135.001,
   135.488,
   135.953,
   136.44,
   136.928,
   137.416,
   137.903,
   138.391,
   138.855,
   139.343,
   139.831,
   140.318,
   140.806,
   141.293,
   141.758,
   142.245,
   142.733,
   143.221,
   143.708,
   144.196,
   144.684,
   145.148,
   145.636,
   146.123,
   146.611,
   147.098,
   147.586,
   148.05,
   148.538,
   149.026,
   149.513,
   150.001,
   150.489,
   150.953,
   151.441,
   151.928,
   152.416,
   152.903,
   153.391,
   153.855,
   154.343,
   154.831,
   155.318,
   155.806,
   156.294,
   156.781,
   157.246,
   157.733,
   158.221,
   158.708,
   159.196,
   159.684,
   160.148,
   160.636,
   161.123,
   161.611,
   162.099,
   162.586,
   163.051,
   163.538,
   164.026,
   164.513,
   165.001,
   165.489,
   165.976,
   166.441,
   166.928,
   167.416,
   167.903,
   168.391,
   168.856,
   169.343,
   169.831,
   170.318,
   170.806
  ],
  "downbeats": [
   0.488,
   2.415,
   4.342,
   6.293,
   8.22,
   10.147,
   12.098,
   14.025,
   15.952,
   17.903,
   19.83,
   21.78,
   23.708,
   25.635,
   27.585,
   29.513,
   31.44,
   33.39,
   35.318,
   37.245,
   39.195,
   41.123,
   43.05,
   45,
   46.928,
   48.878,
   50.805,
   52.756,
   54.683,
   56.61,
   58.561,
   60.488,
   62.415,
   64.342,
   66.293,
   68.22,
   70.147,
   72.098,
   74.025,
   75.952,
   77.903,
   79.83,
   81.757,
   83.708,
   85.635,
   87.586,
   89.513,
   91.44,
   93.391,
   95.318,
   97.245,
   99.196,
   101.123,
   103.05,
   105.001,
   106.928,
   108.855,
   110.806,
   112.733,
   114.683,
   116.611,
   118.561,
   120.488,
   122.439,
   124.343,
   126.293,
   128.221,
   130.148,
   132.098,
   134.026,
   135.953,
   137.903,
   139.831,
   141.758,
   143.708,
   145.636,
   147.586,
   149.513,
   151.441,
   153.391,
   155.318,
   157.246,
   159.196,
   161.123,
   163.051,
   165.001,
   166.928,
   168.856,
   170.806
  ]
 },
 "palettes": {
  "sacred": [
   "#ffb347",
   "#ff7b00",
   "#fff2c4"
  ],
  "festival": [
   "#ff7a00",
   "#ff1f5a",
   "#ffd23f",
   "#00c2a8"
  ],
  "fire": [
   "#ff2a00",
   "#ff8c00",
   "#ffd000"
  ],
  "marigold": [
   "#ffa000",
   "#ff5e00",
   "#ffd54a",
   "#ff2d55"
  ]
 },
 "sections": [
  {
   "id": "s1",
   "start": 0,
   "end": 15.952,
   "kind": "intro",
   "energy": 0.52,
   "group": "A",
   "palette": "sacred"
  },
  {
   "id": "s2",
   "start": 15.952,
   "end": 46.928,
   "kind": "chorus",
   "energy": 0.9,
   "group": "B",
   "palette": "festival"
  },
  {
   "id": "s3",
   "start": 46.928,
   "end": 54.683,
   "kind": "break",
   "energy": 0.48,
   "group": "C",
   "palette": "sacred"
  },
  {
   "id": "s4",
   "start": 54.683,
   "end": 62.415,
   "kind": "build",
   "energy": 0.52,
   "group": "D",
   "palette": "fire"
  },
  {
   "id": "s5",
   "start": 62.415,
   "end": 93.391,
   "kind": "drop",
   "energy": 1,
   "group": "E",
   "palette": "festival"
  },
  {
   "id": "s6",
   "start": 93.391,
   "end": 108.855,
   "kind": "break",
   "energy": 0.54,
   "group": "A",
   "palette": "sacred"
  },
  {
   "id": "s7",
   "start": 108.855,
   "end": 116.611,
   "kind": "verse",
   "energy": 0.49,
   "group": "C",
   "palette": "marigold"
  },
  {
   "id": "s8",
   "start": 116.611,
   "end": 124.343,
   "kind": "build",
   "energy": 0.52,
   "group": "D",
   "palette": "fire"
  },
  {
   "id": "s9",
   "start": 124.343,
   "end": 155.318,
   "kind": "drop",
   "energy": 1,
   "group": "E",
   "palette": "festival"
  },
  {
   "id": "s10",
   "start": 155.318,
   "end": 172.823,
   "kind": "outro",
   "energy": 0.41,
   "group": "A",
   "palette": "sacred"
  }
 ],
 "cues": [
  {
   "t": 0,
   "until": 15.952,
   "layer": "beam",
   "move": {
    "look": "still",
    "pose": "up"
   },
   "dim": {
    "look": "breathe",
    "speed": 16,
    "intensity": 0.45
   },
   "color": {
    "look": "static",
    "palette": "sacred",
    "index": 0
   }
  },
  {
   "t": 0,
   "until": 15.952,
   "layer": "spot",
   "move": {
    "look": "still",
    "pose": "performer"
   },
   "dim": {
    "look": "swell",
    "intensity": 0.6
   },
   "color": {
    "look": "static",
    "palette": "sacred",
    "index": 2
   }
  },
  {
   "t": 0,
   "until": 15.952,
   "layer": "wash",
   "dim": {
    "look": "follow",
    "env": "energy",
    "intensity": 0.55
   },
   "color": {
    "look": "gradient",
    "palette": "sacred"
   }
  },
  {
   "t": 0,
   "until": 15.952,
   "layer": "pixel",
   "dim": {
    "look": "sparkle",
    "density": 0.25,
    "intensity": 0.5
   },
   "color": {
    "look": "static",
    "palette": "sacred",
    "index": 0
   }
  },
  {
   "t": 0,
   "until": 15.952,
   "layer": "laser",
   "dim": {
    "look": "off"
   }
  },
  {
   "t": 0,
   "until": 15.952,
   "layer": "strobe",
   "dim": {
    "look": "off"
   }
  },
  {
   "t": 0,
   "until": 15.952,
   "layer": "blinder",
   "dim": {
    "look": "off"
   }
  },
  {
   "t": 15.952,
   "until": 31.436,
   "layer": "beam",
   "move": {
    "look": "circle",
    "speed": 8,
    "size": 0.5
   },
   "dim": {
    "look": "pulse",
    "on": "half",
    "decay": 0.6,
    "intensity": 0.9
   },
   "color": {
    "look": "cycle",
    "palette": "festival",
    "on": "bar",
    "every": 2
   }
  },
  {
   "t": 15.952,
   "until": 31.436,
   "layer": "spot",
   "move": {
    "look": "sweep",
    "speed": 8,
    "spread": 0.6,
    "tilt": -0.3
   },
   "dim": {
    "look": "on",
    "intensity": 0.85
   },
   "color": {
    "look": "cycle",
    "palette": "festival",
    "on": "phrase"
   }
  },
  {
   "t": 15.952,
   "until": 31.436,
   "layer": "wash",
   "dim": {
    "look": "garba_circle",
    "speed": 16,
    "width": 0.35,
    "direction": "forward"
   },
   "color": {
    "look": "gradient",
    "palette": "festival"
   }
  },
  {
   "t": 15.952,
   "until": 31.436,
   "layer": "pixel",
   "dim": {
    "look": "dandiya_tap",
    "decay": 0.15,
    "intensity": 1
   },
   "color": {
    "look": "split",
    "palette": "festival",
    "split": "lr"
   }
  },
  {
   "t": 15.952,
   "until": 31.436,
   "layer": "laser",
   "move": {
    "look": "sweep",
    "speed": 16,
    "spread": 0.6
   },
   "dim": {
    "look": "on",
    "intensity": 0.6
   },
   "color": {
    "look": "static",
    "palette": "festival",
    "index": 1
   }
  },
  {
   "t": 15.952,
   "until": 31.436,
   "layer": "strobe",
   "dim": {
    "look": "off"
   }
  },
  {
   "t": 15.952,
   "until": 31.436,
   "layer": "blinder",
   "dim": {
    "look": "off"
   }
  },
  {
   "t": 31.436,
   "until": 46.928,
   "layer": "beam",
   "move": {
    "look": "circle",
    "speed": 8,
    "size": 0.5
   },